Content,RT,R1P,LR,EQE,PR,VR,DR,SSR,TR,NRCA,CR,UR,UV,CE,Label
质量挺好的,1,0,5,0,0,0,-1,0,0,1,0,517,1,0.812062763,1
充电器收到了，非常好用，质量很好，物流也很快。,1,0,23,0,0,0,-1,0,0,0,0,2096,1,0.983942148,1
宝贝不错，比较合适！,1,0,10,1,0,0,-1,0,0,0,1,94,1,0.985651622,1
很好，可以用,1,0,6,0,0,0,-1,0,0,1,0,132,0,0.779522998,1
用起来挺好的，厂家客服态度也好，百问不厌，好评,1,0,23,0,0,0,-1,0,0,1,0,193,1,0.021946516,1
一如既往的好品质，非常喜欢的一款产品，非常棒！o(*￣幔*)o,1,0,32,1,0,0,-1,1,0,0,3,237,0,0.999380994,1
非常值得信赖的品牌，质量有保障，价格还亲民，相当满意,1,0,26,0,0,0,-1,1,0,0,6,374,1,0.99943472,1
特意用了一个月才追评的，水吧台很好用，冷藏冷冻效果非常好，而且他家水吧台绝对比别家的便宜，我找了好多家，最好还是决定选择他家，总算没有让我失望，非常值，而且客服服务态度一级棒,1,2,87,0,1,0,-1,0,0,0,0,1055,1,0.212904523,1
宝贝不错哦，够大，是我想要的大小。,1,1,17,0,1,0,-1,0,0,0,6,494,0,0.986831599,1
很喜欢和集美一起使用??花臂小姐姐,1,0,17,2,0,1,-1,0,0,0,4,299,0,0.990522293,1
整体评价：衣服质量很好，是宽松版的，上身效果不错，唯一不好的是我158买的M码，衣服对我来说有一点长，但是我又手贼，拿到衣服简单试了一下就把吊牌给剪了，剪完再穿发现长了，没法退，只能从新下单买s，我买了一黑一咖色，现在含泪250一件转卖，除了吊牌被我剪了，衣服一次没穿新新的，包装盒子衣架啥都有。有喜欢的小伙伴可以找我。诚心转卖，以上都是大实话，骗人生孩子***。,1,6,182,0,0,0,-1,0,0,0,1,274,0,0.000159852,1
发货速度快，包装完好，质量好，做工十分精细，不锈钢材质好清洗，价格优惠,1,0,35,0,0,0,-1,0,0,1,0,2965,0,0.989218531,1
第一次贴没估计好距离整太远了。一觉起来就显色了，不过睡前裹的保鲜膜睡到一半迷迷糊糊摘了，结果手心也印上了orz！睡觉不老实的姐妹一定要确保裹好保鲜膜嗷&mdash;&mdash;颜色比较深的那张是过去78小时了。,1,0,106,1,1,0,-1,0,0,0,4,254,1,0.000530814,1
物流速度快，质量很好??整个风格背上去很赞。书包背后还有一个隐藏的拉链可以放东西。??书包最大的口里面可以放很多东西，书包的料子非常舒服喜欢??真的是不错的一次购物，与我想象中的一样棒，下次一定也要在这里买。,1,1,104,6,1,0,-1,0,0,0,6,15,1,1.0,1
不错的卖家，发货很快,1,0,10,0,0,0,-1,0,0,0,0,1444,0,0.971451918,1
货比了好几家，最后选择了这家，质量不错，物流也很快，推荐购买,1,0,30,0,0,0,-1,0,0,0,0,254,1,0.968715605,1
物流挺快的质量挺好的性价比超高满意,1,0,17,0,0,0,-1,0,0,0,0,1507,0,0.999831101,1
包包容量很大，背上比较时尚百搭。质量挺好的，今年比较流行这个斑马纹。是一次不错的购物，还会继续回购的呢。,1,0,52,0,1,1,-1,0,0,0,6,1154,1,0.99990831,1
一次很好的购物体验，服务周到，物流快速，配送也很周到，态度也很好，物有所值啊，果断好评！刚穿试了一下，店家介绍的尺码很合适。下次在来买。,1,0,68,1,1,0,0,0,0,0,1,368,0,0.999999021,1
物流很快,1,0,4,0,0,0,-1,0,0,0,3,189,1,0.88072436,1
发货很快，孙子很喜欢吃。,1,0,12,0,0,0,-1,0,0,0,3,488,1,0.991369725,1
同城快递????,1,0,8,4,0,0,-1,0,0,0,0,1008,0,0.185840821,1
真的像真纹身的，推荐入手，四天左右时间了，真的好真!真的好帅!巨好看！不要问我为什么贴老虎，哈哈，就是喜欢这种酷酷的。不敢纹身又喜欢纹身的，可以一试,1,1,74,3,1,1,-1,0,0,0,4,14,1,0.999589242,1
对比了好多家感觉这家价格最实惠所以就冲啦,1,0,20,0,1,0,-1,0,0,0,0,965,1,0.936652306,1
卖家很好，包装完好，质量也很好，值得推荐,1,0,20,0,0,0,-1,1,0,0,0,2554,1,0.986797553,1
不错，价格实惠，电源完美匹配，,1,0,15,0,1,0,-1,0,0,0,0,1041,0,0.995632062,1
每一罐都是扁的，第一次买到这样的，之前别家买得都是好好的！找售后也是推托是快递暴力所致！只能认栽！自己吃进！下次不会再买了！,1,0,62,5,1,0,-1,0,0,1,3,1891,0,0.00292583,1
孩子喜欢吃，已经回购了。,1,0,12,0,0,0,-1,0,0,0,3,3157,0,0.858620571,1
非常棒，很容易贴好，而且不掉色，很好看，值得购买,1,0,24,0,0,1,-1,0,0,0,4,203,0,0.99743256,1
买回来就装上了，电池很好，电量足，孩子玩的很开心，也很好安装,1,0,30,0,1,1,-1,0,0,0,0,709,0,0.97345594,1
不错，挺好吃的,1,0,7,0,0,0,-1,0,1,0,3,931,1,0.950015592,1
此用户没有填写评价。,1,0,10,0,1,0,56,0,0,0,0,1120,0,0.145428,1
版型设计非常好，够阔挺不错！卡其色好看,1,0,19,1,0,0,-1,0,0,1,1,1569,0,0.985266536,1
超级喜欢的，分量特别足，味道也不错。,1,0,18,0,0,0,-1,0,1,0,3,685,1,0.958300136,1
很好的宝贝，值得购买&hellip;,1,0,18,0,0,0,-1,0,0,0,0,988,0,0.98182246,1
男朋友很喜欢，会回购的,1,0,11,0,0,0,-1,0,0,1,3,21,1,0.878118483,1
目前用着挺好的 没什么问题,1,0,18,1,1,0,23,0,0,0,0,1477,1,0.727822601,1
整体评价：非常不错，厚薄度：合适穿面料品质：很好上身效果：老公说好看,1,0,34,0,1,0,0,0,0,0,1,2505,0,0.998316015,1
质量非常非常的好，大气即是感！老公喜欢，天天拿着，包内空间宽敞,1,0,31,1,1,0,-1,0,0,0,6,221,1,0.999464874,1
这个产品和它价位相比来说，还是很合适的,1,0,19,0,0,0,-1,1,0,0,6,889,1,0.988912217,1
充电很快，材质挺厚实的,1,0,11,0,0,0,-1,0,1,0,0,1965,1,0.949796595,1
不错的充电器，现在家里的18650电池多了，也需要一个这样的充电器，很满意！,1,0,38,1,0,0,-1,0,0,0,0,1231,0,0.999211229,1
充电器的质量很好，很好用，物流很快。,1,0,18,0,0,0,-1,1,0,0,0,1232,1,0.983680957,1
超漂亮和好用，真的可以充watch6和iPhone12promax，非常M意,1,0,39,0,1,0,-1,0,0,0,0,1971,1,0.950143142,1
做工精致。用起来特别方便。,1,0,13,0,0,0,-1,0,1,0,0,427,1,0.966565816,1
第一次贴没估计好距离整太远了。一觉起来就显色了，不过睡前裹的保鲜膜睡到一半迷迷糊糊摘了，结果手心也印上了orz！睡觉不老实的姐妹一定要确保裹好保鲜膜嗷&mdash;&mdash;颜色比较深的那张是过去85小时了。,1,0,106,1,1,0,-1,0,0,0,4,254,1,2.95e-05,1
质量很好，穿上很舒服，下次还来光顾！,1,0,18,1,0,0,-1,0,1,0,1,634,1,0.940497412,1
正品原装，不解释，就是好，要说15字的好，太难了，耶耶耶,1,0,28,0,1,0,-1,0,0,0,0,2456,1,0.18396209,1
今天刚收到试了一下，手机没放上去就是亮绿灯，蓝灯就是充电状态了。横竖放反应也是很快的，都可以充。一个无线充可以充当几条数据线了，感觉挺好的,1,0,69,0,1,1,-1,0,0,0,0,1359,1,0.265906371,1
面料特别舒服，上身效果很好看朋友看了都说好看！喜欢的宝宝们值得入手！,1,0,34,2,0,0,-1,0,0,1,1,288,0,0.999923394,1
宝贝收到了是正品试机效果好值得购买好评,1,0,19,0,1,0,-1,0,0,0,0,352,0,0.991312748,1
上妆效果：不反光看起来不假今天是第五天了很奈斯我的肤质：我跟弟弟早上同时贴上的我的显色比较慢他当天晚上就黑了我的只有浅浅的灰色不过最后的颜色都很好,1,4,73,0,1,0,-1,0,0,0,4,143,1,0.333936662,1
品质做工：发货快，做工精致，皮质柔软有质感，性价比高，好评,1,0,29,0,1,0,0,0,0,0,6,1879,0,0.999905785,1
挺好看的贴的时候要按照要求贴要不然颜色会浅点图案喜欢还赠了两个小图卖家挺好的,1,0,38,0,1,0,-1,0,0,0,4,86,1,0.996798804,1
这个好吃，就是普通巧克力，只是有夹心，包装不同夹心就不一样，小孩很喜欢吃，就是发货时间太长，差点忘了有买这个,1,0,54,0,0,0,-1,0,0,0,3,1479,0,0.87255776,1
整体评价：非常好持久情况：已经一个多星期了，还没掉色上妆效果：操作非常简单,1,0,37,0,1,0,-1,0,0,0,4,1110,0,0.302758431,1
卖家服务真周到。以后带同事一起来,1,0,16,0,0,0,-1,1,0,0,0,472,1,0.954082428,1
宝贝收到了,1,0,5,0,0,0,-1,0,0,0,3,342,1,0.689020424,1
??商品收到了，包装得很好，物流非常快，客服态度很积极，有问题及时解答！总体来说非常满意！,1,0,45,4,0,0,-1,1,1,0,6,261,1,0.88119672,1
??宝贝质量很好，收到货第一时间打开看了，很不错??，很满意??，客服也有问必答，感谢??,1,0,45,8,0,0,-1,1,0,0,6,343,0,0.692483807,1
爱了好看啊完全不反光发货速度也超快，就是自己需要注意一下睡觉别压着可以拿美纹胶带贴一贴防止印到别的地方过两天就不掉色了很真实洗澡啥的都没弄掉，一下子买了很多够用很久的了,1,0,84,0,1,0,-1,0,0,0,4,607,0,0.341189996,1
充电很快，质量非常好，物流很快，赞赞赞。,1,0,20,0,0,0,-1,1,0,0,0,661,1,0.999973559,1
持久情况：非常好，已经两天了,1,0,14,0,0,1,-1,0,0,0,4,44,1,0.291557326,1
讲真东西还不错，热敷显色挺快的，但是掉色也挺快的。第四天就开始掉色了，我一天贴一个，第四个刚显色第一个就脱色成这样了,1,1,58,0,0,1,-1,0,0,0,4,996,0,0.942711362,1
收到，很好，材质外观都不错，好用,1,0,16,0,0,0,-1,0,0,1,0,895,1,0.995239264,1
很喜欢和集美一起使用??花臂小姐姐,1,0,17,2,0,1,-1,0,0,0,4,299,0,0.990522293,1
先好评，用后评价,1,0,8,0,0,0,-1,0,0,0,0,3568,0,0.270390109,1
非常棒，很容易贴好，而且不掉色，很好看，值得购买,1,0,24,0,0,1,-1,0,0,0,4,203,0,0.99743256,1
方便实用,1,0,4,0,0,0,-1,0,0,0,0,3161,1,0.676470588,1
每次确定收货后，我都会默默好评接着把??????????填满，我觉得这是个好习惯，每当看到:亲，您的评价对别的买家有很大帮助时，我就发誓一定要做个好评专业户去好好帮助别的买家。马云大叔都说了，给好评的买家都是好买家哈。,1,3,109,10,1,0,-1,0,0,0,0,1356,1,0.002369424,1
好吃对象喜欢,1,0,6,0,0,0,-1,0,0,1,3,466,1,0.923268832,1
发货很快，质量挺好的，满意。,1,0,14,0,0,0,-1,1,0,0,0,1240,1,0.982675539,1
很好，物流很快，东西很给力，性价比很高！,1,0,20,1,0,0,-1,1,0,0,6,93,1,0.999250707,1
很好，很不错，和商家描述的一样，好评。,1,0,19,0,0,0,-1,1,0,0,0,1331,1,0.830334583,1
经测试，充电板不走PD协议，应该走QC。多口的充电头是无法激活iPhone10W无线充电，只能6W。单口的U**或U**-C的QC头都可以，没有必要带PD协议。充电头这方面没有倍思的无线充电板兼容性好。图左边的单口充电头都可以满速，右边的多口都不行。,1,0,125,0,1,0,-1,0,0,0,0,1213,0,1.29e-06,1
质量不错，非常实用，价格实惠。,1,0,15,0,0,0,-1,1,0,0,0,475,1,0.988159148,1
包包质量很好，值得购买,1,0,11,0,0,0,-1,1,0,0,6,207,1,0.905200615,1
三合一充电满不错的功能也多，非常实用，好评。,1,0,22,0,0,0,-1,1,0,0,0,272,1,0.703983025,1
宝贝很好非常好用,1,0,8,0,0,0,-1,0,0,0,0,36,1,0.957303961,1
宝贝质量好，是正品，值得拥有,1,0,14,0,0,0,-1,0,0,0,0,2933,1,0.998291035,1
终于买到满意的商品了，超出期望，非常喜欢，身边的人都问我要链接,1,1,31,0,0,0,-1,1,0,0,1,30,1,0.708660173,1
衣衣非常好看，孩子超级喜欢,1,0,13,0,0,0,-1,0,0,0,1,476,1,0.909691634,1
可以的，就是有点像小女孩背的，把麻花绳摘掉还好，质量不错而且很香,1,0,32,0,1,0,-1,0,0,0,6,1280,1,0.977149746,1
整体评价：非常好持久情况：已经一个多星期了，还没掉色上妆效果：操作非常简单,1,0,37,0,1,0,-1,0,0,0,4,1110,0,0.302758431,1
整体评价：非常好持久情况：已经一个多星期了，还没掉色上妆效果：操作非常简单,1,0,37,0,1,0,-1,0,0,0,4,1110,0,0.302758431,1
物美价廉，好评！,1,0,8,1,0,0,-1,0,0,0,3,399,0,0.726419535,1
质量不错，好用，价格实惠，下回有要在来,1,0,19,0,0,0,-1,0,0,0,0,2740,1,0.979966269,1
老板介绍的好，回来装上就可以用了，以后都你家了,1,0,23,0,0,0,-1,0,0,0,0,286,1,0.444398535,1
热度不高，持续发热时间挺久，充电也快，挺好的,1,0,22,0,0,0,-1,0,0,0,0,1326,0,0.960008166,1
10分M意只是airpod用了保o套就用不了,1,0,22,0,0,0,-1,1,1,0,0,1150,0,0.105503244,1
挺好的，目前没问题，后续追评,1,0,14,0,0,0,-1,1,0,0,0,359,1,0.622784768,1
五星好评，非常好！想不到那么快就到了！,1,0,19,2,0,0,-1,1,0,0,0,164,1,0.777209235,1
蛮喜欢的非常不错,1,0,8,0,0,0,-1,0,0,0,0,1187,0,0.966366265,1
宝贝已收到卖家发货迅速，主动联络确认收件地址及发货时间物流也相当给力，隔天已经收到。宝贝实物与评述一致，造工相当不错，没有破损，实际使用与期待的非常接近，非常愉快的购物体验正在快乐使用中日后或会继续光顾好评！,1,0,104,1,0,0,-1,1,0,0,0,3433,1,0.999564356,1
没有保护套，不知道是不是商家给忘装了,1,0,18,0,0,0,-1,0,0,1,0,2245,1,0.320597705,1
很方便，可以手机手表一起充电，手机横过来追剧充电同步操作也ok！记得听卖家建议，配快充头才行！,1,0,47,2,1,1,-1,0,0,0,0,1335,0,0.092470208,1
非常实用，质量好，很满意,1,0,12,0,0,0,-1,1,0,0,0,314,1,0.927727238,1
颜色很正好看。做工不错!对比了几家，性价比质量很满意的，比实体店便宜多了,1,0,36,1,0,0,-1,1,0,0,6,489,0,0.99991075,1
收到了，还不错,1,0,7,0,0,0,-1,0,0,0,0,1154,1,0.80290861,1
看着不错，孩子又能继续看了,1,0,13,0,1,0,-1,0,0,0,0,1256,0,0.968235128,1
宝贝挺好，跟描述的一样，需要再来。物流给力！,1,0,22,1,0,0,-1,0,0,0,3,494,0,0.946087684,1
宝贝收到了，做工质量都不错，很是满意哦，还好回购的,1,0,25,0,0,0,-1,1,0,0,0,1499,1,0.997159151,1
数据线收到了，还送了保护套，希望有！用！拿回来家宝贝就迫不及待打开看了，很满意,1,0,39,2,1,1,-1,0,0,0,0,122,1,0.998659333,1
挺好的，和想象中一样，随意搭都很好看，满意！,1,0,22,1,0,0,-1,1,0,0,6,925,1,0.997072612,1
7号最好喝。毋庸置疑。回购N次配他家卖的这个旋转杯子。一个人喝酒都有了乐趣。放多少酒都不会撒。很有感觉。推荐。,1,0,55,0,1,1,-1,0,0,0,3,1761,0,0.91904056,1
物流很快，充电很方便,1,0,10,0,0,0,-1,0,0,0,0,1432,1,0.873286603,1
收到了，质量棒棒哒，很满意,1,0,13,0,0,0,-1,1,0,0,0,721,1,0.634843858,1
小小的口味超多的。,1,0,9,0,0,0,-1,0,0,0,3,2516,1,0.892486814,1
特别方便，充电也快,1,0,9,0,0,0,-1,0,0,0,0,2130,1,0.638135858,1
质量很好，值得购买！！！,1,0,12,3,0,0,-1,0,0,0,0,1097,1,0.772776555,1
物流迅捷，客服态度很好不错，充电器到手试用满意,1,0,23,0,0,0,-1,0,0,0,0,1985,0,0.970645745,1
很喜欢和集美一起使用??花臂小姐姐,1,0,17,2,0,1,-1,0,0,0,4,299,0,0.990522293,1
应该是正品，很好用,1,0,9,0,0,0,-1,0,0,0,0,1277,1,0.950245559,1
质量一般,1,0,4,0,0,0,-1,0,0,0,0,1012,1,0.498498498,1
质量挺好的，穿着很舒服很有气质。扣子特别有质感,1,0,23,0,0,0,-1,0,0,0,1,2773,0,0.996704122,1
没看到呢，先好评，会追加评论,1,0,14,0,0,0,-1,0,0,0,3,2120,0,0.375058482,1
五星好评，非常好！想不到那么快就到了！,1,0,19,2,0,0,-1,1,0,0,6,1911,1,0.777209235,1
东西很好，日期新鲜。,1,0,10,0,0,0,-1,0,0,0,3,383,0,0.614034545,1
孩子买了很喜欢，下次还来买??,1,0,15,2,0,0,-1,0,0,0,1,32,1,0.922795339,1
图案超可爱！毛线衣软软的，穿着很舒服！,1,0,19,2,0,0,-1,0,0,0,1,1865,0,0.993582138,1
好吃好吃，吃完还会买,1,0,10,0,0,0,-1,0,0,0,3,723,1,0.779847243,1
挺好看的贴的时候要按照要求贴要不然颜色会浅点图案喜欢还赠了两个小图卖家挺好的,1,0,38,0,1,0,-1,0,0,0,4,86,1,0.996798804,1
很精致，质量非常好，很满意的一次购物。谢谢店家！,1,0,24,1,0,0,-1,1,0,0,6,1478,1,0.99420581,1
包装很好很没有破损物流挺快的，老公安装的他懂这个他说挺好安装的很不错用起来也方便,1,0,40,0,0,0,-1,0,0,0,0,490,1,0.991590188,1
质量很好值得购买！,1,0,9,1,1,0,-1,0,0,0,1,1491,0,0.935594038,1
商品质量不错，细节、品质、做工都非常好，发货贼快，快递也给力，棒棒哒~??????,1,0,41,6,0,0,-1,1,0,0,6,1519,0,0.992102722,1
给孩子的车已经装上了，还不错,1,0,14,0,0,0,-1,0,0,1,0,206,1,0.897514077,1
充电器和数据线质量很好，外观大气，使用方便，充电很快，满意。,1,0,30,0,0,0,-1,0,0,0,0,1298,0,0.999936327,1
挺好的，电量充足,1,0,8,0,0,0,-1,0,1,0,0,639,0,0.809149105,1
是理想中的产品，质量不错，物流也很快，值得点赞,1,0,23,0,0,0,-1,1,0,0,0,161,1,0.999234346,1
尝试不同的口味，不错噢！,1,0,12,1,0,0,-1,0,0,0,3,1469,1,0.993905085,1
大容量也是正常容量，并没有很大。但是能用。,1,0,21,0,0,0,-1,0,0,0,0,1759,0,0.613332338,1
原装正品，充电效果就是不一样,1,0,14,0,0,0,-1,0,1,0,0,1135,1,0.710202571,1
宝贝说味道不错，很好吃,1,0,11,0,0,0,-1,0,0,0,3,906,0,0.9526602,1
质量非常好！买他买他买他～,1,0,13,1,0,0,-1,0,0,1,1,714,1,0.606481674,1
收到啦卖家发货很快，质量很好，充电速度很快很安全,1,0,24,0,0,0,-1,0,1,0,0,926,1,0.977216481,1
充电器速度很快，一个小时就充满了，和店家描述一样。,1,0,25,0,0,0,-1,0,0,0,0,1015,0,0.995633804,1
整体评价：面料不错，版型显瘦，肩宽袖子长度都刚好，颜色洋气，直播买到性价比还可以，发货有点慢,1,0,46,0,0,0,-1,0,0,1,1,1883,0,0.996007375,1
宝贝质量很好，跟预想的一样，挺不错的，有需要会再来。,1,0,26,0,0,0,-1,0,0,0,0,1371,1,0.997217121,1
非常满意，质量真心不错，合心意,1,0,15,0,0,0,-1,0,0,0,1,1021,0,0.936771024,1
是原装正品货，充电很快跟原装的一样，质量杠杠滴，满意满意,1,0,28,0,0,0,-1,0,0,0,0,1125,1,0.974077168,1
产品真的超级棒，下次还会买的，愿越做越好，非常好的购物体验,1,0,29,0,0,0,-1,1,0,0,1,35,1,0.996877817,1
闲置五六年的小汽车满血复活，客服推荐的很准确，还配了个遥控器。回来就能用，杠杠的,1,0,40,0,0,0,-1,0,0,0,0,1315,0,0.045909696,1
质量很好，快速充电,1,0,9,0,0,0,-1,0,0,0,0,1332,1,0.749787163,1
感谢百亿补贴！！！风速很大，最小风速就已经很大了！,1,0,25,4,1,0,-1,0,0,0,0,1153,1,0.024706537,1
客观建议正常充电还是没问题的耳机手表手机都可就是有一点慢手表存在部分虚电情况发热量几乎没有发热,1,0,47,0,0,0,-1,1,0,0,0,195,1,0.000132218,1
东西很好女朋友很喜欢用了两次充电后不会变鼓在被子里可以保温六七个小时,1,0,34,0,0,0,-1,0,0,0,0,8,1,0.335805934,1
实物很好看，反应很灵敏,1,0,11,0,1,0,-1,0,0,0,0,1764,0,0.780047914,1
非常漂亮质量也非常好??卖家可能看到我送货地址是在酒店。所以特别安排发顺丰快递给我。在上海酒店今天下单，隔天就能收到货了。卖家服务非常好让我非常满意。物廉价美，值得信赖的卖家，大力推荐给大家,1,3,95,2,1,0,-1,0,0,0,6,4381,0,0.801898626,1
衣橱里差不多都是你家衣服，一直喜欢一直买买买，爱了爱了,1,0,27,0,1,0,-1,0,0,0,1,513,1,0.953081987,1
产品质量真的很好商家服务态度也好,1,0,16,0,1,0,-1,0,0,0,0,1613,0,0.240265566,1
很不错，孩子很喜欢！,1,0,10,1,0,0,-1,0,0,0,3,276,0,0.992574371,1
整体评价：很喜欢嘿嘿持久情况：目前没有掉色，快一个星期了买来后一直忘记贴，今天才想起来哈哈哈,1,0,46,0,1,0,-1,0,0,0,4,180,1,0.976441689,1
上妆效果：不反光看起来不假今天是第五天了很奈斯我的肤质：我跟弟弟早上同时贴上的我的显色比较慢他当天晚上就黑了我的只有浅浅的灰色不过最后的颜色都很好,1,4,73,0,1,0,-1,0,0,0,4,143,1,0.333936662,1
不错，是原装的，充电速度很快！,1,0,15,1,0,0,-1,0,0,0,0,1222,1,0.973448141,1
包装精致，发货快，质量好，防折线保护套特赞！,1,0,22,1,1,0,-1,0,0,0,0,1207,0,0.994697775,1
(?&bull;??&bull;?)??价格超优惠，非常棒，完美的一次购物,1,0,37,6,0,0,-1,0,0,0,0,578,0,0.995836949,1
质量很好，买的很合我心意??，棒棒哒！需要的亲们可以放心购买,1,1,30,3,0,0,-1,0,0,1,1,264,1,0.761225,1
质量不错，好评。,1,0,8,0,0,0,-1,0,0,0,0,590,0,0.800850551,1
挺好的，不伤头发，吹得很柔顺。,1,0,15,0,0,0,-1,0,0,0,0,2507,0,0.640077878,1
实物很好看，反应很灵敏,1,0,11,0,1,0,-1,0,0,0,0,1764,0,0.780047914,1
物流很快，很喜欢，会继续支持,1,0,14,0,0,0,-1,0,0,1,3,2005,0,0.979797087,1
宝贝包装结实，发货快，质量可以??!,1,0,18,3,1,0,0,0,0,0,0,11253,0,0.866717007,1
回购，小朋友好喜欢这款巧克力，每次让他们挑就跟抽奖一样的,1,0,28,0,1,0,-1,0,0,1,3,8933,0,0.995291296,1
物流很快，值这个价钱，非常满意,1,0,15,0,0,0,-1,1,0,1,0,1352,1,0.966086934,1
衣服厚实，很好穿，也很可爱,1,0,13,0,0,0,-1,0,0,0,1,1516,1,0.973449333,1
真的像真纹身的，推荐入手，四天左右时间了，真的好真!真的好帅!巨好看！不要问我为什么贴老虎，哈哈，就是喜欢这种酷酷的。不敢纹身又喜欢纹身的，可以一试,1,1,74,3,1,1,-1,0,0,0,4,14,1,0.999589242,1
包包质量非常的不错款式简单大方空间够大拿手上气派头十足哦满意,1,0,30,0,0,0,-1,1,0,0,6,77,1,0.999951719,1
假的，不能用，只用了一次，第二次使用打开一直开关机，页面打不开，用回以前的充电线就好好的,1,0,18,1,0,0,16,0,0,0,0,1776,0,0.000347991,1
充电效果给力，满意,1,0,9,0,0,0,-1,0,0,0,0,2795,0,0.623530824,1
东西质量很好，卖家也挺热情的！倍量电池和冲电器很好用！值得拥有！下次还来,1,0,36,3,1,1,-1,0,0,0,0,847,0,0.999759136,1
外包装好看，有点小,1,0,9,0,0,0,-1,0,0,0,3,1189,0,0.405398951,1
衣服很好看上身效果也很好,1,0,12,0,0,0,-1,1,0,1,1,441,0,0.985408699,1
性价比高价格实惠卖家服务态度也很好值得购买,1,0,21,0,0,0,-1,0,0,0,1,275,1,0.998547456,1
讲真东西还不错，热敷显色挺快的，但是掉色也挺快的。第四天就开始掉色了，我一天贴一个，第四个刚显色第一个就脱色成这样了,1,1,58,0,0,1,-1,0,0,0,4,996,0,0.942711362,1
很好，发货快，服务特别好，满意好评,1,0,17,0,0,0,-1,1,0,0,0,1750,1,0.963381818,1
整体评价：非常好持久情况：已经一个多星期了，还没掉色上妆效果：操作非常简单,1,0,37,0,1,0,-1,0,0,0,4,1110,0,0.302758431,1
大电瓶电力很足，小孩玩的很开心,1,0,15,0,1,0,-1,0,0,0,0,66,1,0.980957902,1
充电器是正品，原装正品，充电特别的快，质量也很好。,1,0,25,0,0,0,-1,0,1,0,0,982,1,0.998606298,1
不错如果输入电流在大点好了充两块电池得8个多小时,1,0,24,0,0,0,-1,0,0,0,0,1200,0,0.331241971,1
挺好用的，性价比高,1,0,9,0,0,0,-1,0,0,1,0,363,1,0.988712762,1
宝贝收到了质量不错，正品很好用,1,0,15,0,0,0,-1,0,0,0,0,478,1,0.994777169,1
包装很好，质量非常棒，宝贝完全符合卖家的描述，可以放心购买??感谢??,1,0,35,4,0,0,-1,1,0,0,6,859,1,0.999584119,1
拍了个寂寞哈哈！等到显完了在拍,1,0,15,1,0,1,-1,0,0,0,4,79,0,0.987972381,1
宝贝收到就迫不及待开充了感谢商家送的应急插头派上用场现在比我想象的还要粗充电速度蛮快的。,1,1,44,0,1,1,-1,0,0,0,0,316,1,0.461899671,1
很好的购买平台，质量不错，特别是有品牌的，值得信赖当时买的时候还在犹豫价格，买来之后一点都不后悔，而且物流还快，可以入手,1,0,60,0,0,0,-1,0,0,0,1,332,1,0.998841,1
宝贝特点：非常新，耐用，,1,0,12,0,0,0,-1,0,0,0,0,142,0,0.920066552,1
检查过了，是正品没错了，可以买，比官网便宜，赞赞赞,1,0,25,0,1,0,-1,0,0,0,0,1105,0,0.999558776,1
好评，很热情的卖家,1,0,9,0,0,0,-1,0,0,0,0,2232,1,0.790423544,1
第二次回购，超级好吃，太满意了，全家人都爱吃,1,0,22,0,0,0,-1,0,0,0,3,1464,0,0.530185611,1
冲的很快,1,0,4,0,0,0,-1,0,0,0,0,1903,0,0.866806621,1
口感味道：这个也好吃！,1,0,11,1,0,0,-1,0,1,0,3,49,1,0.711050991,1
非常好看，挺好的，下次还买,1,0,13,0,0,0,-1,0,0,0,1,80,1,0.935188347,1
很好吃，不错的一次网购,1,0,11,0,1,0,-1,0,0,0,3,232,1,0.751056895,1
非常不错，充电很快，很好用。,1,0,14,0,0,0,-1,0,0,0,0,1298,1,0.984772827,1
好吃实惠实实在在一桶,1,0,10,0,0,0,-1,0,0,0,3,1531,0,0.934911943,1
此用户没有填写评价。,1,0,10,0,0,0,8,0,0,1,0,1569,0,0.145428,1
包装真的很用心，已经是第二次购买了，味道也不错，必须好评这家店,1,0,31,0,0,0,-1,0,0,0,3,400,1,0.831831644,1
发货确实是很快的客服态度是很好的而且价格比较便宜,1,0,24,0,0,0,-1,1,0,0,0,944,1,0.784580036,1
好看的面料挺阔,1,0,7,0,0,0,-1,0,0,1,1,1012,0,0.666275866,1
宝贝收到了，质量款式不错，充电特快，值得推荐。,1,0,23,0,0,0,-1,0,0,0,0,390,1,0.985997828,1
衣服很好看，材料穿着也不扎，挺好,1,0,16,0,0,0,-1,0,0,1,1,1200,0,0.966290437,1
衣服非常喜欢、一直买这家店铺的衣服质量方面也非常喜欢,1,0,26,0,1,0,-1,0,0,0,1,25,1,0.706131281,1
方便快捷，不错，有需要在来。,1,0,14,0,0,0,-1,0,0,1,0,235,1,0.790991304,1
宝贝收到了好评好评，,1,0,10,0,0,0,-1,0,0,0,0,327,1,0.537440182,1
质量很好，用着很方便，充电很快,1,0,15,0,0,0,-1,1,0,0,0,2550,1,0.981099439,1
