Content,RT,R1P,LR,EQE,PR,VR,DR,SSR,TR,NRCA,CR,UR,UV,CE,Label
第一次贴没估计好距离整太远了。一觉起来就显色了，不过睡前裹的保鲜膜睡到一半迷迷糊糊摘了，结果手心也印上了orz！睡觉不老实的姐妹一定要确保裹好保鲜膜嗷&mdash;&mdash;颜色比较深的那张是过去61小时了。,1,0,106,1,1,0,-1,0,0,0,4,254,1,0.000177,1
好吃！下次再买！,1,0,8,2,0,0,-1,0,0,0,3,126,0,0.484876722,1
可以，很甜,1,0,5,0,0,0,-1,0,0,0,3,66,1,0.860799984,1
还可以～,1,0,4,0,0,0,-1,0,1,0,0,508,0,0.601161242,1
充电方便，产品质量好，物美价廉,1,0,15,0,0,0,-1,1,0,0,0,1033,1,0.745626002,1
很方便，省了很多地方，手表充电也挺快,1,0,18,0,0,0,-1,1,0,0,0,1674,0,0.747904871,1
不错，功率大,1,0,6,0,0,0,-1,0,0,0,0,2342,0,0.810871005,1
第一次贴没估计好距离整太远了。一觉起来就显色了，不过睡前裹的保鲜膜睡到一半迷迷糊糊摘了，结果手心也印上了orz！睡觉不老实的姐妹一定要确保裹好保鲜膜嗷&mdash;&mdash;颜色比较深的那张是过去55小时了。,1,0,106,1,1,0,-1,0,0,0,4,254,1,0.000177,1
衣服好看，我觉得高个子，矮个子都可以驾驭哦，也很好搭配显气质，嘻嘻稀罕,1,1,35,0,1,0,-1,0,0,0,1,1100,0,0.998796512,1
用了十天线就断了,1,0,18,1,0,0,39,0,0,1,0,336,0,0.253627651,1
一直在这家买,1,0,6,0,0,0,-1,0,0,0,3,472,1,0.349123422,1
质量不错，充电安全方便，机箱也挺厚实，值得拥有,1,0,23,0,0,0,-1,0,0,1,0,223,0,0.949721041,1
正品！充电速度非常快！赞??,1,0,14,4,0,0,-1,0,0,0,0,2153,0,0.994768925,1
真的像真纹身的，推荐入手，四天左右时间了，真的好真!真的好帅!巨好看！不要问我为什么贴老虎，哈哈，就是喜欢这种酷酷的。不敢纹身又喜欢纹身的，可以一试,1,1,74,3,1,1,-1,0,0,0,4,14,1,0.999589242,1
宝贝质量不错，很喜欢。,1,0,11,0,0,0,-1,1,0,0,0,2614,0,0.987620853,1
第三次购买，女儿喜欢吃,1,0,11,0,0,0,-1,0,0,0,3,642,0,0.837113125,1
给孩子买的，很喜欢，感觉很酷。,1,0,15,0,0,0,-1,0,0,0,1,38,1,0.983986131,1
宝贝收到啦，质量不错,1,0,10,0,0,0,-1,0,0,0,0,386,0,0.823476095,1
宝贝很好，充电速度很快，很满意,1,0,15,0,1,0,-1,0,0,0,0,523,1,0.996745789,1
第一次贴没估计好距离整太远了。一觉起来就显色了，不过睡前裹的保鲜膜睡到一半迷迷糊糊摘了，结果手心也印上了orz！睡觉不老实的姐妹一定要确保裹好保鲜膜嗷&mdash;&mdash;颜色比较深的那张是过去35小时了。,1,0,106,1,1,0,-1,0,0,0,4,254,1,9.66e-05,1
不错不错，很多牌子的，特别好,1,0,14,0,0,0,-1,0,0,0,3,1079,0,0.991513208,1
非常的nice，每次都买他家衣服质量很好搞活动还有优惠。,1,0,28,0,1,0,-1,0,0,0,1,188,1,0.777722751,1
衣服非常好，穿起来刚好合适，非常保暖，穿起来非常好看，这个冬天有它就不会冷快递服务非常好,1,0,44,0,0,0,-1,1,0,0,1,89,0,0.847870005,1
上身效果超棒，面料也不错哦，收藏店铺了，永远回购的小店哟，谢谢,1,0,31,0,1,0,0,0,0,0,1,2018,0,0.998879482,1
原装的充电超级快，半个小时就充满了，太好了。,1,0,22,0,0,0,-1,0,1,0,0,370,1,0.780553471,1
味道正忠,1,0,4,0,0,0,-1,0,0,1,3,143,1,0.404225259,1
好产品、好品质、好服务，宝贝确实值这个价钱，在这给商家点个赞??,1,0,32,2,0,0,-1,1,0,0,6,62,0,0.993652529,1
挺好滴！物流很快，质量真心奥利给！我喜欢！么么哒！,1,1,25,4,0,0,-1,1,0,0,0,928,1,0.989295604,1
好吃，送人的，大盒好看,1,0,11,0,0,0,-1,0,0,0,3,1819,1,0.64416299,1
爱了好看啊完全不反光发货速度也超快，就是自己需要注意一下睡觉别压着可以拿美纹胶带贴一贴防止印到别的地方过两天就不掉色了很真实洗澡啥的都没弄掉，一下子买了很多够用很久的了,1,0,84,0,1,0,-1,0,0,0,4,607,0,0.341189996,1
充电很快，而且不是很贵，这个价钱都值了。,1,0,20,0,0,0,-1,1,0,0,0,705,1,0.856283851,1
宝贝是真的，去店里鉴定过了，谢谢老板,1,0,18,0,1,0,-1,0,0,0,6,13,1,0.383817832,1
持久情况：非常好，已经两天了,1,0,14,0,0,1,-1,0,0,0,4,44,1,0.291557326,1
好吃！真的！！！非常棒！会回购！！,1,0,17,7,0,0,-1,0,0,1,3,199,1,0.410989588,1
买来送人的，到货很及时～,1,0,12,0,0,0,-1,0,1,0,0,521,0,0.522769425,1
产品非常棒棒，几个设备只要一根线就够了，充电速度很快。主要喜欢这种磨砂黑，低调而奢华！支持,1,0,45,1,1,1,-1,0,0,0,0,1694,0,0.999934574,1
好用，满意，充电快,1,0,9,0,0,0,-1,0,0,0,0,1777,0,0.824607826,1
上妆效果：不反光看起来不假今天是第五天了很奈斯我的肤质：我跟弟弟早上同时贴上的我的显色比较慢他当天晚上就黑了我的只有浅浅的灰色不过最后的颜色都很好,1,4,73,0,1,0,-1,0,0,0,4,143,1,0.333936662,1
好吃就是量少价格比外面还是便宜,1,0,15,0,0,0,-1,0,0,0,3,2042,0,0.437009194,1
闪充就是快，感觉比原装好用！哈哈,1,0,16,1,0,0,-1,0,0,0,0,1032,1,0.827365433,1
衣服给老公买的，他太喜欢穿了，合身，穿着特好看,1,0,23,0,0,0,-1,0,0,0,1,148,1,0.858903404,1
羽绒宝贝非常棒，是自己想要的那种风格，到货也很快，谢谢老板，服务五颗星,1,0,35,0,0,0,-1,0,1,0,1,59,1,0.999030195,1
充电很方便，桌子也不乱了，发货也很快。,1,0,19,0,0,0,-1,1,0,0,0,382,1,0.364737311,1
快递很快包装完整服务态度很好做工精细没有线头比实体店实惠不错的产品质量有保障正品一分价格一分货谢谢老板,1,0,51,0,0,0,-1,0,0,0,1,28,1,0.999964921,1
第一次吃这个是小伙伴去玩耍带回来的，吃起来不错就网上也买了一箱，味道是一样的，下次想吃还是会回购的，卖家发货也很快。,1,0,58,0,0,0,-1,0,0,0,3,4,1,0.972912644,1
跟图片一样，很好看！,1,0,10,1,0,0,-1,0,0,0,0,1555,0,0.851685937,1
购买的电池很快收到了，用了质量非常好，电量足，使用时间很长，物流特别快，客服服务热情，以后买儿童电动车电池就在他家购买,1,0,59,0,1,0,-1,0,0,1,0,129,1,0.980745284,1
无线充电器收到了，质量好，价格实惠，很喜欢。,1,0,22,0,0,0,-1,1,1,0,0,2898,1,0.989236983,1
宝贝特别喜欢，颜值高质量好，中看又中用，有需要的朋友不要犹豫了，最后祝商家生意兴隆！??值得购买！没有什么味道，用起来还可以??，没有不舒服的地方??，所以我还蛮喜欢的,1,1,84,8,1,0,-1,0,0,0,0,257,1,0.99971429,1
是正品，是自己想要的，满意好评。,1,0,16,0,0,0,-1,0,0,0,0,1135,1,0.909621545,1
超好看！第一眼就爱上了，秋天穿正好，颜色也很秋天,1,0,24,1,0,0,-1,0,0,0,1,1082,0,0.988180244,1
值得推荐购买,1,0,6,0,0,0,-1,0,1,0,0,1515,0,0.887699517,1
发货很快！质量很好！很满意的一次购物!值得推荐！,1,0,24,4,0,0,-1,1,0,0,0,642,1,0.998674795,1
衣服质量不错，快递隔天就到了，会回购的????,1,0,23,4,1,0,0,0,0,0,1,1226,0,0.205202561,1
阔以,1,0,2,0,0,0,7,0,0,0,0,1024,0,0.5,1
包包不错，还行，送人很有面,1,0,13,0,0,0,-1,1,0,0,6,661,0,0.95985737,1
好吃，会回购,1,0,6,0,0,0,-1,0,0,0,3,486,0,0.297668723,1
宝贝收到了，质量很好，很满意！好评！,1,0,18,2,0,0,-1,0,0,0,0,1021,0,0.948115765,1
非常ok，比实体店便宜很多，买它。,1,0,17,0,1,0,-1,0,0,0,0,1148,0,0.84713003,1
衣服很不值这个价钱,1,0,9,0,0,0,-1,0,1,0,1,1725,0,0.686443767,1
拍了个寂寞哈哈！等到显完了在拍,1,0,15,1,0,1,-1,0,0,0,4,79,0,0.987972381,1
包装非常好，很严实，值这个价格,1,0,15,0,0,0,-1,1,0,0,0,2871,0,0.477175204,1
大小合适，孩子很喜欢棒棒哒,1,0,13,0,1,0,-1,0,0,0,6,29,1,0.978781298,1
东西收到了，质量很好，是正品，值得购买,1,0,19,0,0,0,-1,1,0,0,0,2150,1,0.97714104,1
使用方便性价比高，值得购买。,1,0,14,0,0,0,-1,0,0,0,0,1918,0,0.989306581,1
宝贝质量很好，做工精细，我非常满意,1,1,17,0,0,0,-1,1,0,0,0,1072,0,0.99839041,1
此用户没有填写评价。,1,0,10,0,0,0,4,0,0,0,1,1096,1,0.145428,1
质量可以，充电快又方便，挺好用的,1,0,16,0,0,0,-1,1,0,1,0,1336,1,0.831819529,1
质量非常好，物流非常快,1,0,11,0,0,0,-1,0,1,0,0,1014,1,0.798541137,1
&nbsp;质量非常好，与卖家描述的完全一致，非常满意,1,0,27,0,0,0,-1,0,0,1,0,3296,0,0.834303083,1
发货快，质量好，材质上乘，做工精细,1,0,17,0,0,1,17,0,0,0,0,1111,1,0.998955438,1
男朋友挺喜欢的，好看，简单，我们的确是一个人的生活方式，开心,1,1,30,0,0,0,-1,1,0,0,6,415,1,0.998829001,1
整体评价：非常好持久情况：已经一个多星期了，还没掉色上妆效果：操作非常简单,1,0,37,0,1,0,-1,0,0,0,4,1110,0,0.302758431,1
上妆效果：不反光看起来不假今天是第五天了很奈斯我的肤质：我跟弟弟早上同时贴上的我的显色比较慢他当天晚上就黑了我的只有浅浅的灰色不过最后的颜色都很好,1,4,73,0,1,0,-1,0,0,0,4,143,1,0.333936662,1
好吃！！！下次回购！！,1,0,11,5,0,0,-1,0,0,0,3,382,1,0.040478476,1
不错的东西，物流速度快，服务态度好，，包装不错，可以的,1,0,27,0,0,0,-1,0,0,0,0,1801,0,0.993747101,1
上妆效果：不反光看起来不假今天是第五天了很奈斯我的肤质：我跟弟弟早上同时贴上的我的显色比较慢他当天晚上就黑了我的只有浅浅的灰色不过最后的颜色都很好,1,4,73,0,1,0,-1,0,0,0,4,143,1,0.333936662,1
宝贝收到了，质量不错挺好用的。很满意值得购买。,1,0,23,0,0,0,-1,0,0,0,0,1451,0,0.998869905,1
非常满意，质量不错,1,0,9,0,0,0,-1,0,0,0,0,2194,1,0.922886914,1
非常不错，很好吃,1,0,8,0,0,0,-1,0,0,0,3,40,1,0.932965007,1
质量真是没话说，下次还会光顾的,1,0,15,0,0,0,-1,1,0,0,0,2637,1,0.609267882,1
拍了个寂寞哈哈！等到显完了在拍,1,0,15,1,0,1,-1,0,0,0,4,79,0,0.987972381,1
此用户没有填写评价。,1,0,10,0,0,0,0,0,0,0,1,1543,0,0.145428,1
宝贝收到了，质量很好，充电很快，是正品,1,0,19,0,0,0,-1,0,0,0,0,1072,1,0.991121179,1
宝贝特别好高大上配了快充头充的特别快三个一起充也非常方便很满意的一次购物！,1,0,37,1,1,0,-1,0,0,0,0,403,1,0.999671193,1
充电很快，质量都不错，蛮满意的。,1,0,16,0,0,0,-1,1,0,0,0,1557,1,0.989664176,1
东西很满意，跟描述的一样，有需要还会再来,1,0,20,0,0,0,-1,0,1,0,0,389,1,0.866977061,1
宝贝跟商家描述的一样，物流很快，价格实惠值得推荐,1,0,24,0,0,0,-1,0,0,0,0,340,0,0.994180376,1
拍了个寂寞哈哈！等到显完了在拍,1,0,15,1,0,1,-1,0,0,0,4,79,0,0.987972381,1
到货很快，挺好用的，价格也合理，好评！,1,0,19,1,0,0,-1,0,0,0,0,1120,1,0.952971138,1
第二次购买了，真心不错，下次又来。,1,0,17,0,0,0,-1,0,0,0,3,506,0,0.88988755,1
好吃，挺脆的，新鲜,1,0,9,0,0,0,-1,0,1,0,3,136,1,0.561942035,1
这家店很好，顶一个，来买过几次，服务非常周到，宝贝很满意，这么诚信，以后还会经常来！！！,1,0,44,3,0,0,-1,0,0,0,0,628,1,0.788546492,1
好吃跟普通的巧克力不一样最喜欢草莓夹心的,1,0,20,0,1,0,-1,0,0,0,3,1318,0,0.964476391,1
宝贝已收到。包装很到位，充电速度也很快，真不错,1,0,23,0,0,0,-1,1,0,0,0,1342,1,0.996283093,1
还可以颜值算比较好的吧,1,0,11,0,0,0,-1,0,0,0,0,2134,0,0.718990911,1
质量很好。时尚大气。很喜欢会再买,1,0,16,0,0,0,-1,1,0,0,6,483,1,0.998129349,1
宝贝说很可爱值了,1,0,8,0,1,0,-1,0,0,0,3,57,1,0.953991633,1
货到很快包装完好，质量挺好的，宝宝的摩托换了很好用，好评！,1,0,29,1,0,0,-1,0,0,0,0,2611,0,0.993037269,1
好吃又可爱,1,0,5,0,0,0,-1,0,0,0,3,373,1,0.836522568,1
今天收到，做工很高，充电也好，下次还买这家,1,0,21,0,1,0,0,0,0,0,0,162,1,0.672299977,1
很好用用起来也很方便质量也很好价钱还便宜,1,0,20,0,0,0,-1,1,0,0,0,2010,1,0.995418476,1
用了一月已牡,1,0,18,1,1,0,48,0,0,0,0,1966,0,0.005274428,1
质量很好，176160拍的xl刚刚好,1,0,18,0,0,0,-1,0,0,1,1,1025,1,0.825804648,1
不错，很好用！,1,0,7,1,0,0,-1,0,0,0,0,2485,0,0.951812329,1
物流很快，做工精细，材质不错，比较满意的一次购物体验了,1,0,27,0,0,0,-1,1,0,0,0,1588,0,0.99990861,1
充电很快，稳定，做工精致,1,0,12,0,0,0,-1,0,0,0,0,1427,1,0.993859077,1
非常喜欢吃感谢卖家发货速度祝生意兴隆,1,0,18,0,0,0,-1,0,0,1,3,2506,1,0.991043965,1
快递有点慢，我慢慢喝,1,1,10,0,0,0,-1,0,0,0,3,3032,0,0.275374107,1
价格便宜包装很好,1,0,8,0,0,0,-1,0,0,1,0,95,1,0.850185253,1
绝对是最开心的一次购物，店家服务态度很好，售后也是,1,0,25,0,0,0,-1,1,0,0,0,1805,0,0.880080613,1
10分M意只是airpod用了保o套就用不了,1,0,22,0,0,0,-1,1,1,0,0,1150,0,0.105503244,1
持久情况：非常好，已经两天了,1,0,14,0,0,1,-1,0,0,0,4,44,1,0.291557326,1
衣服收到了质量好穿着很舒服老公非常满意,1,0,19,0,0,0,-1,0,1,1,1,1007,1,0.931172806,1
包装很好，也很好吃，满意！,1,0,13,1,0,0,-1,0,0,0,3,80,1,0.929301386,1
不爱甜食不爱巧克力，独爱这款巧克力。爱的味道，赞,1,0,24,0,0,0,-1,0,0,0,3,1397,0,0.999548667,1
大小刚刚好，换个电瓶宝宝的三轮车又可以玩了，很不错。物美价廉,1,0,30,0,0,0,-1,0,0,0,0,1023,1,0.970908707,1
奶茶设备做工质量很好，价格很实惠，效率高操作简单方便！,1,0,27,1,0,0,-1,0,1,1,0,682,0,0.999939245,1
真的推荐啊，快递速度特别的快，爱了爱了,1,0,19,0,0,0,-1,1,0,0,6,203,1,0.968175379,1
和男朋友还有他两个朋友一顿饭不到就喝完了,1,0,20,0,0,0,-1,0,0,1,3,865,1,0.438194731,1
宝贝已收到??，超级喜欢，颜值高又实用，超级喜欢！???和图片一模一样,1,0,35,6,0,0,-1,0,0,0,0,740,0,0.689051339,1
一个字，好！,1,0,6,1,0,0,-1,0,0,0,3,531,1,0.58432844,1
很好，孩子喜欢,1,0,7,0,0,0,-1,0,0,0,3,32,1,0.956764481,1
挺不错的，用起来方便，好评,1,0,13,0,0,0,0,0,1,0,0,654,0,0.919253273,1
尺码标准，老公穿着很帅气,1,0,12,0,0,0,-1,0,0,1,1,93,1,0.862713013,1
非常喜欢，质量又好，太爱了,1,0,13,0,0,0,-1,1,0,0,1,422,1,0.818621901,1
有点甜，还行,1,0,6,0,0,0,-1,0,0,0,3,2565,0,0.884999722,1
是理想中的产品??，质量不错，物流也很快，值得点赞！,1,0,26,3,0,0,-1,1,0,0,0,930,0,0.997453217,1
质量很好性价比高很满意,1,0,11,0,0,0,-1,1,0,0,0,2801,1,0.990573005,1
充电器还不错,1,0,6,0,0,0,-1,0,0,0,0,1398,0,0.973412192,1
做工真的非常精细，细节真的棒，爱了爱了,1,0,19,0,0,0,-1,0,1,0,1,1072,1,0.999538179,1
好吃不贵东西好,1,0,7,0,0,0,-1,0,0,0,3,577,0,0.509214596,1
宝贝质量很好，做工精细，性价比高，很满意,1,0,20,0,0,0,-1,1,0,0,0,576,1,0.999952101,1
安装简单，使用方便。,1,0,10,0,0,0,-1,0,0,0,0,536,1,0.476476207,1
做工很好厚实穿上也有型就是有一丢丢线头,1,0,19,0,0,0,-1,0,0,0,1,1808,0,0.933887139,1
好用，操作简单，价格实在????,1,0,16,4,0,0,-1,0,0,1,0,87,1,0.278102585,1
第一时间用上了，安装简单，自动断电，用着也安全,1,0,23,0,0,0,-1,0,0,1,0,739,0,0.023315916,1
质感好，一看就是正品，哈哈，下次直接在你家买,1,0,22,0,1,0,-1,0,0,0,0,1634,0,0.986135939,1
很好很好很好,1,0,6,0,1,1,-1,0,0,0,0,3323,0,0.972843618,1
不错不错很好吃,1,0,7,0,0,0,-1,0,0,0,3,1795,1,0.987301967,1
质量挺好的满意,1,0,7,0,0,0,-1,0,0,0,0,2095,0,0.903028187,1
充电器质量非常好，充电速度很快。,1,0,16,0,0,0,-1,0,0,0,0,1517,0,0.979796845,1
电池挺给力的,1,0,6,0,0,0,-1,0,0,1,0,975,1,0.71379507,1
送男朋友的，希望他喜欢,1,0,11,0,0,0,-1,0,0,0,3,282,1,0.806078812,1
喜欢，料子也厚度还行不错喜欢,1,0,14,0,0,0,-1,0,0,1,1,1193,0,0.962249421,1
看起来还可以，还没用。,1,0,11,0,0,0,-1,0,0,0,0,1508,0,0.465140089,1
不好意思确认晚了，衣服很帅，老公很喜欢，保暖性好，上身很平整，型帅??,1,0,35,2,0,0,-1,0,0,0,1,80,1,0.994361871,1
宝贝收到了，质量特别好，使用起来特别方便，值得推荐,1,0,25,0,0,0,-1,0,0,0,0,885,1,0.96530886,1
卖家发货很快，质量做工都不错，使用效果很好，满意的一次购物,1,0,29,0,0,0,-1,1,0,0,0,853,1,0.999677128,1
充电器也很好，感谢卖家有这么物美价廉的宝贝。,1,0,22,0,0,0,-1,0,0,0,0,149,1,0.997372291,1
包装非常仔细、严实，物流公司服务态度很好,1,0,20,0,0,0,-1,1,0,0,0,769,0,0.834356978,1
面料我感觉还不错，版型OK，而且女朋友说贼可爱,1,1,23,0,1,0,-1,0,0,0,1,266,1,0.977531415,1
质量不错，物流也很快，值得点赞！,1,0,16,1,0,0,-1,1,0,1,0,373,1,0.997834986,1
刚装上很期待,0,0,6,0,0,0,-1,0,0,1,0,296,0,0.629506057,1
很好看哦，有oversize的效果，推荐了好几个朋友买,1,0,27,0,1,0,-1,0,0,0,1,1661,0,0.911028084,1
快递送的很及时，包装的也不错。,1,0,15,0,0,0,-1,1,0,0,0,2016,1,0.695980276,1
西服很有个性，衣服质量真的很ok的，炒鸡显瘦，完美的外套，而且西装很有分量，爱了爱了~~~,1,0,45,0,1,0,-1,0,0,0,1,1752,1,0.999970307,1
不要犹豫  直接买   西服很有质感   没有多余的线头 我已经穿了大半个月了  是真的很不错  话不多说看图,-2,0,11,0,1,0,20,0,0,0,1,30,1,0.997540126,1
宝贝收到了，质量很好很不错，做工精致完美，非常满意喜欢,1,0,27,0,0,0,-1,0,0,0,0,159,0,0.999957023,1
是正品，充的很快，差不多30充满，方便很多,1,0,21,0,1,0,-1,0,0,0,0,1156,0,0.989951815,1
哎，Q了一是那毛病，真的oZ了，f是oQ。\M自己掏。y道一不行再Q一，Q起]完]了幔慷且商家f也]k法，要我相信他。]k法解Q}能QQQ。,1,0,18,1,0,0,59,0,1,0,0,378,0,1.67e-12,1
非常棒，很容易贴好，而且不掉色，很好看，值得购买,1,0,24,0,0,1,-1,0,0,0,4,203,0,0.99743256,1
正品,1,0,2,0,0,0,-1,0,0,1,0,64,1,0.857142857,1
物流很快，质量很好，很满意。,1,0,14,0,0,0,-1,1,0,0,0,385,1,0.988248771,1
快充收到了，质量很好，充电真的比那些快，还会继续光顾,1,0,26,0,0,0,-1,0,0,0,0,3466,0,0.922519295,1
料子版型厚度什么都好，唯一美中不足的就是口袋是假的，其他都很满意了,1,0,33,0,0,0,-1,0,0,1,1,1267,1,0.995402448,1
简直太好用了，只能用完美来形容！强烈推荐！,1,0,21,2,0,0,-1,1,0,0,0,61,1,0.200639187,1
不错，挺好的,1,0,6,0,0,0,-1,0,0,1,1,1342,1,0.964252713,1
这个还不错，可以用，希望不要像之前的一样，坏的太快了,1,0,26,0,0,0,-1,0,0,0,0,1642,0,0.809388126,1
是理想中的产品??，质量不错，物流也很快，值得点赞！,1,0,26,3,0,0,-1,1,0,0,1,9,1,0.997453217,1
好东西，好用宝贝，货到快服务好。,1,0,16,0,0,0,-1,0,0,0,0,244,1,0.975808404,1
质感超棒推荐,1,0,6,0,0,0,-1,0,0,0,1,3211,0,0.980483752,1
宝贝很不错哦数据长充电快喜欢哦,1,0,15,0,0,0,-1,0,0,0,0,109,1,0.9942259,1
用起来挺不错的，质量也挺好，很喜欢这家的吹风机！,1,0,24,1,0,0,-1,0,0,0,0,129,1,0.988646109,1
充电器还不错，很满意！,1,0,11,1,0,0,-1,0,0,0,0,1093,0,0.993214753,1
第二次买这里的巧克力了送人的还送了一包泡芙很棒,1,0,23,0,0,0,-1,0,0,0,3,428,1,0.985986603,1
外形外观：质量一般，材质看着比较轻薄廉价,1,0,20,0,0,0,-1,0,0,0,0,1788,0,0.989403602,1
这样的充电器很实用省空间还美观放在工作台上养眼我喜欢充电很快??,1,1,32,2,0,0,-1,1,0,0,0,3863,1,0.997183154,1
非常满意！性价比蛮高的，以后还会再买滴~,1,0,20,1,0,0,-1,1,0,0,0,762,1,0.987647097,1
物美价廉，很喜欢，以后还会继续光顾！,1,0,18,1,1,0,-1,0,0,0,0,1762,1,0.957326497,1
挺好的，喜欢,1,0,6,0,0,0,-1,0,1,0,3,58,1,0.91004619,1
速度很快,1,0,4,0,0,0,-1,0,1,0,0,723,0,0.92827909,1
非常好用！我的桌面一下子就整洁多啦！,1,1,18,2,0,0,-1,1,0,0,0,572,1,0.746363982,1
很好用，也很方便，试用了一晚上没啥问题。好评,1,0,22,0,0,0,-1,1,0,0,0,1197,1,0.55419733,1
爱了好看啊完全不反光发货速度也超快，就是自己需要注意一下睡觉别压着可以拿美纹胶带贴一贴防止印到别的地方过两天就不掉色了很真实洗澡啥的都没弄掉，一下子买了很多够用很久的了,1,0,84,0,1,0,-1,0,0,0,4,607,0,0.341189996,1
给侄儿买的，小孩子很喜欢吃，吃完再来买,1,0,19,0,0,0,-1,0,0,0,3,165,0,0.498321523,1
好像染色了一样，也不是正常的甜味。很小个的桃子买过很多黄桃罐头，第一次买的这么差的,1,0,41,0,0,0,-1,0,0,0,3,4469,0,0.071560751,1
宝贝挺好，发货太慢,1,0,9,0,0,0,-1,0,0,0,0,1147,1,0.795483476,1
nice，不错的，这家店挺好，推荐,1,0,17,0,0,0,-1,0,0,0,1,14,1,0.896658027,1
挺好看的贴的时候要按照要求贴要不然颜色会浅点图案喜欢还赠了两个小图卖家挺好的,1,0,38,0,1,0,-1,0,0,0,4,86,1,0.996798804,1
包装很结实，店家很有耐心，有需要还会回购的,1,0,21,0,0,0,-1,1,0,0,0,1292,1,0.883558897,1
很喜欢和集美一起使用??花臂小姐姐,1,0,17,2,0,1,-1,0,0,0,4,299,0,0.990522293,1
孩子喜欢吃，,1,0,6,0,0,0,-1,0,0,0,3,411,1,0.870896353,1
充电挺快的，是正品，值得推荐,1,0,14,0,0,0,-1,1,0,1,0,1081,1,0.986859932,1
上妆效果：不反光看起来不假今天是第五天了很奈斯我的肤质：我跟弟弟早上同时贴上的我的显色比较慢他当天晚上就黑了我的只有浅浅的灰色不过最后的颜色都很好,1,4,73,0,1,0,-1,0,0,0,4,143,1,0.333936662,1
包包质量不错，赠品也多，下次还回购。,1,0,18,0,0,1,-1,0,0,0,6,332,0,0.49839646,1
质量蛮好的，设计合理，使用起来也方便,1,0,18,0,0,0,-1,0,0,1,0,774,1,0.881914901,1
宝贝质量不错，很喜欢了。谢谢掌柜。,1,0,17,0,0,0,-1,1,0,1,0,611,1,0.989650458,1
货收到了，还没空给孩子装上，以前的快递有人打电话通知，现在没有,1,0,31,0,0,0,-1,0,0,0,0,78,1,0.003881342,1
快递发货很快宝贝效果不错很满意,1,0,15,0,0,0,-1,0,0,0,0,117,0,0.995805647,1
宝贝收到挺不错，发货很快，充电确实快,1,0,18,0,0,0,-1,0,0,0,0,885,1,0.997317733,1
和女朋友买的情侣衫，很可爱很奈斯_,1,0,17,0,1,0,-1,0,0,0,1,8,1,0.993175419,1
衣服很好看，很有型，穿着很洋气。,1,0,16,0,0,0,-1,0,1,1,1,1297,1,0.987227674,1
不错，相信小米,1,0,7,0,0,0,-1,0,0,0,0,3722,0,0.965437557,1
手感有点硬,1,0,5,0,0,0,-1,0,0,1,1,1519,0,0.489627315,1
不错，谢谢老板,1,0,7,0,0,0,-1,0,0,0,1,222,1,0.824987391,1
发货快，质量非常不错，充电快,1,0,14,0,0,0,-1,1,0,0,0,1423,1,0.931204965,1
很喜欢的一款,1,0,6,0,0,0,-1,0,0,0,0,1253,1,0.85165417,1
非常好吃的黄桃罐头，忍不住又买了一箱～,1,0,19,0,1,0,-1,0,0,0,3,1101,0,0.466140355,1
包包非常好，很大气，上档次，老公非常喜欢，棒棒的,1,0,24,0,1,0,0,0,0,0,6,58,1,0.999942919,1
衣服面料更舒服，穿着更舒服，下次还买这家店的,1,0,22,0,0,0,-1,0,0,0,1,119,1,0.845566807,1
不错，价格便宜，孩子们喜欢吃，值得购买,1,0,19,0,0,0,-1,0,0,0,3,789,1,0.997238083,1
拿回来就用上啦，质量也很好。好几天啦孩子说终于能看小度啦,1,0,28,0,1,0,-1,0,0,0,0,153,0,0.722133315,1
第一次贴没估计好距离整太远了。一觉起来就显色了，不过睡前裹的保鲜膜睡到一半迷迷糊糊摘了，结果手心也印上了orz！睡觉不老实的姐妹一定要确保裹好保鲜膜嗷&mdash;&mdash;颜色比较深的那张是过去13小时了。,1,0,106,1,1,0,-1,0,0,0,4,254,1,0.000122076,1
宝贝不错，客服也非常nice，很耐心回复我各种问题，三合一功能强大，附带的快充头充电也非常快,1,1,46,0,1,1,-1,0,0,0,0,1864,0,0.900952536,1
美观实用，充电快。,1,0,9,0,0,0,-1,0,0,0,0,1519,1,0.775160503,1
上妆效果：不反光看起来不假今天是第五天了很奈斯我的肤质：我跟弟弟早上同时贴上的我的显色比较慢他当天晚上就黑了我的只有浅浅的灰色不过最后的颜色都很好,1,4,73,0,1,0,-1,0,0,0,4,143,1,0.333936662,1
很好，和宝贝的电动玩具汽车匹配！,1,0,16,1,0,0,-1,0,0,0,0,1477,1,0.989167872,1
原装正品没错了，和家里的原装一样的，放心购买吧,1,0,23,0,1,0,-1,0,0,0,0,2137,1,0.976047717,1
宝贝收到了，很合适，穿上很好看,1,0,15,0,0,0,-1,0,0,0,1,173,1,0.975470586,1
真的像真纹身的，推荐入手，四天左右时间了，真的好真!真的好帅!巨好看！不要问我为什么贴老虎，哈哈，就是喜欢这种酷酷的。不敢纹身又喜欢纹身的，可以一试,1,1,74,3,1,1,-1,0,0,0,4,14,1,0.999589242,1
实物与描述的一样，质量相当好，卖家态度也好，有问必答，发货速度杠杠的，值得购买哦,1,0,40,0,0,0,-1,1,0,0,3,136,1,0.997527558,1
正品已验证，速度快，发货快，服务好。,1,0,18,0,0,0,-1,0,0,1,0,2250,0,0.994494475,1
整体评价：非常好持久情况：已经一个多星期了，还没掉色上妆效果：操作非常简单,1,0,37,0,1,0,-1,0,0,0,4,1110,0,0.302758431,1
东西质量还可以，快递速度也很给力,1,0,16,0,0,0,-1,1,0,0,1,2022,1,0.610279413,1
第一次贴没估计好距离整太远了。一觉起来就显色了，不过睡前裹的保鲜膜睡到一半迷迷糊糊摘了，结果手心也印上了orz！睡觉不老实的姐妹一定要确保裹好保鲜膜嗷&mdash;&mdash;颜色比较深的那张是过去91小时了。,1,0,106,1,1,0,-1,0,0,0,4,254,1,0.000177,1
无线充电器收到了，质量不错做工精细非常实用的宝贝。,1,0,25,0,0,0,-1,1,0,0,0,1329,1,0.999394776,1
质量可以，物美价廉,1,0,9,0,0,0,-1,0,0,1,0,541,1,0.766427824,1
